{
  "schemaVersion": "1.0",
  "packId": "hnsw-explainer",
  "version": 1,
  "title": "How HNSW Works",
  "assets": [
    {
      "assetId": "slide-01",
      "fingerprint": "dhash-v1:c949494949393979",
      "title": "How HNSW Works",
      "readingOrder": [
        "title",
        "brand-label",
        "subtitle-label",
        "body-text",
        "hnsw-diagram"
      ],
      "regions": [
        {
          "regionId": "brand-label",
          "bounds": {
            "x": 0.05,
            "y": 0.06,
            "width": 0.1,
            "height": 0.05
          },
          "shortDescription": "Brand name 'Quantiiv' in small white text in the top-left corner.",
          "plainLanguage": "The word 'Quantiiv' appears in the top-left corner as a brand name."
        },
        {
          "regionId": "subtitle-label",
          "bounds": {
            "x": 0.05,
            "y": 0.62,
            "width": 0.45,
            "height": 0.06
          },
          "shortDescription": "Blue uppercase text reading 'ENGINEERING EXPLAINER', used as a category label above the main title.",
          "plainLanguage": "A blue label above the main title that says 'ENGINEERING EXPLAINER'."
        },
        {
          "regionId": "title",
          "bounds": {
            "x": 0.05,
            "y": 0.67,
            "width": 0.55,
            "height": 0.12
          },
          "shortDescription": "Large bold white heading reading 'How HNSW Works'.",
          "plainLanguage": "The main title reads 'How HNSW Works' in large white letters."
        },
        {
          "regionId": "body-text",
          "bounds": {
            "x": 0.05,
            "y": 0.81,
            "width": 0.48,
            "height": 0.1
          },
          "shortDescription": "White body text reading: 'Hierarchical Navigable Small Worlds — the graph index behind fast approximate nearest-neighbor search.'",
          "plainLanguage": "A short description that says HNSW stands for Hierarchical Navigable Small Worlds, and it is the index used for fast approximate nearest-neighbor search."
        },
        {
          "regionId": "hnsw-diagram",
          "bounds": {
            "x": 0.78,
            "y": 0.5,
            "width": 0.2,
            "height": 0.42
          },
          "shortDescription": "A stylized diagram showing three stacked parallelogram-shaped layers connected by a vertical dashed line. Each layer contains blue circular nodes linked by lines. The bottom layer has a green node, suggesting a point of interest at the lowest level.",
          "plainLanguage": "A simple drawing of three flat stacked layers, each with dots connected by lines, representing the layered graph structure of HNSW. A green dot marks one node on the bottom layer."
        }
      ]
    },
    {
      "assetId": "slide-02",
      "fingerprint": "dhash-v1:a4d4a4cae8e88c27",
      "title": "The Nearest-Neighbor Problem",
      "readingOrder": [
        "title",
        "section-label",
        "intro-text",
        "complexity-cards",
        "caveat-text",
        "diagram"
      ],
      "regions": [
        {
          "regionId": "section-label",
          "bounds": {
            "x": 0.055,
            "y": 0.055,
            "width": 0.25,
            "height": 0.04
          },
          "shortDescription": "Small blue uppercase label reading ",
          "plainLanguage": "A small label at the top reads "
        },
        {
          "regionId": "intro-text",
          "bounds": {
            "x": 0.055,
            "y": 0.23,
            "width": 0.47,
            "height": 0.17
          },
          "shortDescription": "Paragraph stating: \"Given a query embedding, find the most similar vectors in a collection. The exact answer requires a distance computation against every single vector.\" The phrase \"every single vector\" is bold.",
          "plainLanguage": "To find the closest match exactly, you must compare the query to every single vector in the collection."
        },
        {
          "regionId": "complexity-cards",
          "bounds": {
            "x": 0.055,
            "y": 0.38,
            "width": 0.47,
            "height": 0.22
          },
          "shortDescription": "Two side-by-side cards. Left card: \"Brute force, per query\" with complexity O(N · d) and note \"100M vectors × 1,536 dims — seconds\". Right card (blue): \"HNSW, per query\" with complexity ~O(log N) and note \"Milliseconds, at 95–99% recall\".",
          "plainLanguage": "Brute force search costs O(N·d) time — seconds for large datasets. HNSW cuts that to roughly O(log N) — milliseconds — but with 95–99% accuracy."
        },
        {
          "regionId": "caveat-text",
          "bounds": {
            "x": 0.055,
            "y": 0.62,
            "width": 0.47,
            "height": 0.15
          },
          "shortDescription": "Paragraph reading: \"The catch: it is approximate — it occasionally misses the true nearest neighbor. For search, RAG, and recommendations, that trade is almost always worth it.\" The word \"approximate\" is italicised.",
          "plainLanguage": "The downside is that HNSW sometimes misses the true closest match, but for most uses like search and recommendations that small error is acceptable."
        },
        {
          "regionId": "diagram",
          "bounds": {
            "x": 0.54,
            "y": 0.18,
            "width": 0.44,
            "height": 0.65
          },
          "shortDescription": "A scatter diagram of grey dots connected by thin grey lines radiating from a central orange dot labelled \"query\". A green dot nearby is labelled \"nearest\", connected to the query dot by a short green line.",
          "plainLanguage": "A diagram showing many grey dots spread out, all connected by lines to one central orange dot called \"query\". The closest dot is green and labelled \"nearest\"."
        }
      ]
    },
    {
      "assetId": "slide-03",
      "fingerprint": "dhash-v1:a498e09898989891",
      "title": "Skip Lists",
      "readingOrder": [
        "title",
        "subtitle-label",
        "intro-text",
        "skip-list-diagram",
        "footer-note"
      ],
      "regions": [
        {
          "regionId": "subtitle-label",
          "bounds": {
            "x": 0.055,
            "y": 0.055,
            "width": 0.22,
            "height": 0.04
          },
          "shortDescription": "Small blue uppercase label reads: \"THE CORE IDEA, IN 1-D\".",
          "plainLanguage": "A small label at the top says \"THE CORE IDEA, IN 1-D\"."
        },
        {
          "regionId": "intro-text",
          "bounds": {
            "x": 0.055,
            "y": 0.155,
            "width": 0.82,
            "height": 0.115
          },
          "shortDescription": "Two sentences of body text: \"Sparse 'express lanes' sit above the full list. Start on the top lane and take big jumps; drop down a lane whenever the next jump would overshoot. Finding 31 takes 3 hops instead of scanning 7 nodes.\"",
          "plainLanguage": "The text explains that skip lists use fast upper lanes to jump ahead, dropping to lower lanes when a jump goes too far, finding 31 in just 3 hops."
        },
        {
          "regionId": "skip-list-diagram",
          "bounds": {
            "x": 0.12,
            "y": 0.28,
            "width": 0.78,
            "height": 0.55
          },
          "shortDescription": "A three-level skip list diagram with levels L0, L1, and L2. L0 is the full linked list: H, 3, 7, 12, 19, 25, 31, 42, 57. L1 contains H, 7, 25, and 42. L2 contains H and 25. Blue highlighted nodes mark the search path through H→25 (L2), down to 25 (L1), where a dashed arrow to 42 is labeled \"overshoots\" in red, then down to 25 (L0), stepping to node 31 highlighted in green and labeled \"found\" in green.",
          "plainLanguage": "The diagram shows three rows of linked boxes (levels L0–L2). The search jumps along the top rows to node 25, skips node 42 because it is too big, then steps right on the bottom row to find node 31, shown in green."
        },
        {
          "regionId": "footer-note",
          "bounds": {
            "x": 0.055,
            "y": 0.83,
            "width": 0.72,
            "height": 0.05
          },
          "shortDescription": "Footer text reads: \"HNSW applies the same 'coarse first, fine last' idea to a proximity graph in high-dimensional space.\" with the word \"graph\" in bold.",
          "plainLanguage": "A note at the bottom says HNSW uses this same coarse-to-fine idea, but on a graph in high-dimensional space."
        }
      ]
    },
    {
      "assetId": "slide-04",
      "fingerprint": "dhash-v1:a4c4eccccccccc87",
      "title": "The Layered Graph",
      "readingOrder": [
        "title",
        "layered-graph-diagram",
        "bullet-points"
      ],
      "regions": [
        {
          "regionId": "title",
          "bounds": {
            "x": 0.04,
            "y": 0.04,
            "width": 0.5,
            "height": 0.14
          },
          "shortDescription": "Section label reads \"THE STRUCTURE\" in small blue caps above the main heading \"The Layered Graph\" in large bold text.",
          "plainLanguage": "The slide heading says \"The Layered Graph\" under a small label that reads \"THE STRUCTURE\"."
        },
        {
          "regionId": "layered-graph-diagram",
          "bounds": {
            "x": 0.1,
            "y": 0.18,
            "width": 0.55,
            "height": 0.62
          },